No.     Time           Source                Destination           Protocol Length Info
      1 0.000000       172.217.18.46         192.168.1.4           TCP      66     443 → 61760 [ACK] Seq=1 Ack=1 Win=1315 Len=0 TSval=76029511 TSecr=290688714

Frame 1: 66 bytes on wire (528 bits), 66 bytes captured (528 bits) on interface en0, id 0
Ethernet II, Src: Sagemcom_b0:4f:d9 (f4:6b:ef:b0:4f:d9), Dst: Apple_ec:49:ad (38:f9:d3:ec:49:ad)
Internet Protocol Version 4, Src: 172.217.18.46, Dst: 192.168.1.4
Transmission Control Protocol, Src Port: 443, Dst Port: 61760, Seq: 1, Ack: 1, Len: 0

No.     Time           Source                Destination           Protocol Length Info
      2 0.041045       172.217.18.238        192.168.1.4           TCP      66     443 → 61763 [ACK] Seq=1 Ack=1 Win=1050 Len=0 TSval=2510020920 TSecr=290688726

Frame 2: 66 bytes on wire (528 bits), 66 bytes captured (528 bits) on interface en0, id 0
Ethernet II, Src: Sagemcom_b0:4f:d9 (f4:6b:ef:b0:4f:d9), Dst: Apple_ec:49:ad (38:f9:d3:ec:49:ad)
Internet Protocol Version 4, Src: 172.217.18.238, Dst: 192.168.1.4
Transmission Control Protocol, Src Port: 443, Dst Port: 61763, Seq: 1, Ack: 1, Len: 0

No.     Time           Source                Destination           Protocol Length Info
      3 0.046656       172.217.18.238        192.168.1.4           TCP      66     443 → 61763 [ACK] Seq=1 Ack=354 Win=1050 Len=0 TSval=2510020927 TSecr=290688726

Frame 3: 66 bytes on wire (528 bits), 66 bytes captured (528 bits) on interface en0, id 0
Ethernet II, Src: Sagemcom_b0:4f:d9 (f4:6b:ef:b0:4f:d9), Dst: Apple_ec:49:ad (38:f9:d3:ec:49:ad)
Internet Protocol Version 4, Src: 172.217.18.238, Dst: 192.168.1.4
Transmission Control Protocol, Src Port: 443, Dst Port: 61763, Seq: 1, Ack: 354, Len: 0

No.     Time           Source                Destination           Protocol Length Info
      4 0.050244       172.217.18.238        192.168.1.4           TCP      66     443 → 61763 [ACK] Seq=1 Ack=385 Win=1050 Len=0 TSval=2510020929 TSecr=290688726

Frame 4: 66 bytes on wire (528 bits), 66 bytes captured (528 bits) on interface en0, id 0
Ethernet II, Src: Sagemcom_b0:4f:d9 (f4:6b:ef:b0:4f:d9), Dst: Apple_ec:49:ad (38:f9:d3:ec:49:ad)
Internet Protocol Version 4, Src: 172.217.18.238, Dst: 192.168.1.4
Transmission Control Protocol, Src Port: 443, Dst Port: 61763, Seq: 1, Ack: 385, Len: 0

No.     Time           Source                Destination           Protocol Length Info
      5 0.226641       172.217.18.238        192.168.1.4           TLSv1.2  421    Application Data

Frame 5: 421 bytes on wire (3368 bits), 421 bytes captured (3368 bits) on interface en0, id 0
Ethernet II, Src: Sagemcom_b0:4f:d9 (f4:6b:ef:b0:4f:d9), Dst: Apple_ec:49:ad (38:f9:d3:ec:49:ad)
Internet Protocol Version 4, Src: 172.217.18.238, Dst: 192.168.1.4
Transmission Control Protocol, Src Port: 443, Dst Port: 61763, Seq: 1, Ack: 385, Len: 355
Transport Layer Security

No.     Time           Source                Destination           Protocol Length Info
      6 0.226751       192.168.1.4           172.217.18.238        TCP      66     61763 → 443 [ACK] Seq=385 Ack=356 Win=2042 Len=0 TSval=290689016 TSecr=2510021048

Frame 6: 66 bytes on wire (528 bits), 66 bytes captured (528 bits) on interface en0, id 0
Ethernet II, Src: Apple_ec:49:ad (38:f9:d3:ec:49:ad), Dst: Sagemcom_b0:4f:d9 (f4:6b:ef:b0:4f:d9)
Internet Protocol Version 4, Src: 192.168.1.4, Dst: 172.217.18.238
Transmission Control Protocol, Src Port: 61763, Dst Port: 443, Seq: 385, Ack: 356, Len: 0

No.     Time           Source                Destination           Protocol Length Info
      7 0.227421       172.217.18.238        192.168.1.4           TLSv1.2  97     Application Data

Frame 7: 97 bytes on wire (776 bits), 97 bytes captured (776 bits) on interface en0, id 0
Ethernet II, Src: Sagemcom_b0:4f:d9 (f4:6b:ef:b0:4f:d9), Dst: Apple_ec:49:ad (38:f9:d3:ec:49:ad)
Internet Protocol Version 4, Src: 172.217.18.238, Dst: 192.168.1.4
Transmission Control Protocol, Src Port: 443, Dst Port: 61763, Seq: 356, Ack: 385, Len: 31
Transport Layer Security

No.     Time           Source                Destination           Protocol Length Info
      8 0.227515       192.168.1.4           172.217.18.238        TCP      66     61763 → 443 [ACK] Seq=385 Ack=387 Win=2047 Len=0 TSval=290689016 TSecr=2510021048

Frame 8: 66 bytes on wire (528 bits), 66 bytes captured (528 bits) on interface en0, id 0
Ethernet II, Src: Apple_ec:49:ad (38:f9:d3:ec:49:ad), Dst: Sagemcom_b0:4f:d9 (f4:6b:ef:b0:4f:d9)
Internet Protocol Version 4, Src: 192.168.1.4, Dst: 172.217.18.238
Transmission Control Protocol, Src Port: 61763, Dst Port: 443, Seq: 385, Ack: 387, Len: 0

No.     Time           Source                Destination           Protocol Length Info
      9 0.227997       172.217.18.238        192.168.1.4           TLSv1.2  105    Application Data

Frame 9: 105 bytes on wire (840 bits), 105 bytes captured (840 bits) on interface en0, id 0
Ethernet II, Src: Sagemcom_b0:4f:d9 (f4:6b:ef:b0:4f:d9), Dst: Apple_ec:49:ad (38:f9:d3:ec:49:ad)
Internet Protocol Version 4, Src: 172.217.18.238, Dst: 192.168.1.4
Transmission Control Protocol, Src Port: 443, Dst Port: 61763, Seq: 387, Ack: 385, Len: 39
Transport Layer Security

No.     Time           Source                Destination           Protocol Length Info
     10 0.228126       192.168.1.4           172.217.18.238        TCP      66     61763 → 443 [ACK] Seq=385 Ack=426 Win=2047 Len=0 TSval=290689017 TSecr=2510021048

Frame 10: 66 bytes on wire (528 bits), 66 bytes captured (528 bits) on interface en0, id 0
Ethernet II, Src: Apple_ec:49:ad (38:f9:d3:ec:49:ad), Dst: Sagemcom_b0:4f:d9 (f4:6b:ef:b0:4f:d9)
Internet Protocol Version 4, Src: 192.168.1.4, Dst: 172.217.18.238
Transmission Control Protocol, Src Port: 61763, Dst Port: 443, Seq: 385, Ack: 426, Len: 0

No.     Time           Source                Destination           Protocol Length Info
     11 0.228610       192.168.1.4           172.217.18.238        TLSv1.2  105    Application Data

Frame 11: 105 bytes on wire (840 bits), 105 bytes captured (840 bits) on interface en0, id 0
Ethernet II, Src: Apple_ec:49:ad (38:f9:d3:ec:49:ad), Dst: Sagemcom_b0:4f:d9 (f4:6b:ef:b0:4f:d9)
Internet Protocol Version 4, Src: 192.168.1.4, Dst: 172.217.18.238
Transmission Control Protocol, Src Port: 61763, Dst Port: 443, Seq: 385, Ack: 426, Len: 39
Transport Layer Security

No.     Time           Source                Destination           Protocol Length Info
     12 0.323324       172.217.18.238        192.168.1.4           TCP      66     443 → 61763 [ACK] Seq=426 Ack=424 Win=1050 Len=0 TSval=2510021203 TSecr=290689017

Frame 12: 66 bytes on wire (528 bits), 66 bytes captured (528 bits) on interface en0, id 0
Ethernet II, Src: Sagemcom_b0:4f:d9 (f4:6b:ef:b0:4f:d9), Dst: Apple_ec:49:ad (38:f9:d3:ec:49:ad)
Internet Protocol Version 4, Src: 172.217.18.238, Dst: 192.168.1.4
Transmission Control Protocol, Src Port: 443, Dst Port: 61763, Seq: 426, Ack: 424, Len: 0

No.     Time           Source                Destination           Protocol Length Info
     13 1.912762       192.168.1.4           2.17.24.94            TLSv1.2  90     Application Data

Frame 13: 90 bytes on wire (720 bits), 90 bytes captured (720 bits) on interface en0, id 0
Ethernet II, Src: Apple_ec:49:ad (38:f9:d3:ec:49:ad), Dst: Sagemcom_b0:4f:d9 (f4:6b:ef:b0:4f:d9)
Internet Protocol Version 4, Src: 192.168.1.4, Dst: 2.17.24.94
Transmission Control Protocol, Src Port: 61855, Dst Port: 443, Seq: 1, Ack: 1, Len: 24
Transport Layer Security

No.     Time           Source                Destination           Protocol Length Info
     14 1.916117       192.168.1.4           2.17.24.94            TCP      66     61855 → 443 [FIN, ACK] Seq=25 Ack=1 Win=2052 Len=0 TSval=290690699 TSecr=2247669765

Frame 14: 66 bytes on wire (528 bits), 66 bytes captured (528 bits) on interface en0, id 0
Ethernet II, Src: Apple_ec:49:ad (38:f9:d3:ec:49:ad), Dst: Sagemcom_b0:4f:d9 (f4:6b:ef:b0:4f:d9)
Internet Protocol Version 4, Src: 192.168.1.4, Dst: 2.17.24.94
Transmission Control Protocol, Src Port: 61855, Dst Port: 443, Seq: 25, Ack: 1, Len: 0

No.     Time           Source                Destination           Protocol Length Info
     15 1.935068       2.17.24.94            192.168.1.4           TCP      66     443 → 61855 [ACK] Seq=1 Ack=25 Win=501 Len=0 TSval=2247729594 TSecr=290690695

Frame 15: 66 bytes on wire (528 bits), 66 bytes captured (528 bits) on interface en0, id 0
Ethernet II, Src: Sagemcom_b0:4f:d9 (f4:6b:ef:b0:4f:d9), Dst: Apple_ec:49:ad (38:f9:d3:ec:49:ad)
Internet Protocol Version 4, Src: 2.17.24.94, Dst: 192.168.1.4
Transmission Control Protocol, Src Port: 443, Dst Port: 61855, Seq: 1, Ack: 25, Len: 0

No.     Time           Source                Destination           Protocol Length Info
     16 1.936229       2.17.24.94            192.168.1.4           TLSv1.2  90     Application Data

Frame 16: 90 bytes on wire (720 bits), 90 bytes captured (720 bits) on interface en0, id 0
Ethernet II, Src: Sagemcom_b0:4f:d9 (f4:6b:ef:b0:4f:d9), Dst: Apple_ec:49:ad (38:f9:d3:ec:49:ad)
Internet Protocol Version 4, Src: 2.17.24.94, Dst: 192.168.1.4
Transmission Control Protocol, Src Port: 443, Dst Port: 61855, Seq: 1, Ack: 25, Len: 24
Transport Layer Security

No.     Time           Source                Destination           Protocol Length Info
     17 1.936349       192.168.1.4           2.17.24.94            TCP      54     61855 → 443 [RST] Seq=25 Win=0 Len=0

Frame 17: 54 bytes on wire (432 bits), 54 bytes captured (432 bits) on interface en0, id 0
Ethernet II, Src: Apple_ec:49:ad (38:f9:d3:ec:49:ad), Dst: Sagemcom_b0:4f:d9 (f4:6b:ef:b0:4f:d9)
Internet Protocol Version 4, Src: 192.168.1.4, Dst: 2.17.24.94
Transmission Control Protocol, Src Port: 61855, Dst Port: 443, Seq: 25, Len: 0

No.     Time           Source                Destination           Protocol Length Info
     18 1.936656       2.17.24.94            192.168.1.4           TCP      66     443 → 61855 [FIN, ACK] Seq=25 Ack=25 Win=501 Len=0 TSval=2247729594 TSecr=290690695

Frame 18: 66 bytes on wire (528 bits), 66 bytes captured (528 bits) on interface en0, id 0
Ethernet II, Src: Sagemcom_b0:4f:d9 (f4:6b:ef:b0:4f:d9), Dst: Apple_ec:49:ad (38:f9:d3:ec:49:ad)
Internet Protocol Version 4, Src: 2.17.24.94, Dst: 192.168.1.4
Transmission Control Protocol, Src Port: 443, Dst Port: 61855, Seq: 25, Ack: 25, Len: 0

No.     Time           Source                Destination           Protocol Length Info
     19 1.936661       2.17.24.94            192.168.1.4           TCP      66     443 → 61855 [ACK] Seq=26 Ack=26 Win=501 Len=0 TSval=2247729595 TSecr=290690699

Frame 19: 66 bytes on wire (528 bits), 66 bytes captured (528 bits) on interface en0, id 0
Ethernet II, Src: Sagemcom_b0:4f:d9 (f4:6b:ef:b0:4f:d9), Dst: Apple_ec:49:ad (38:f9:d3:ec:49:ad)
Internet Protocol Version 4, Src: 2.17.24.94, Dst: 192.168.1.4
Transmission Control Protocol, Src Port: 443, Dst Port: 61855, Seq: 26, Ack: 26, Len: 0

No.     Time           Source                Destination           Protocol Length Info
     20 1.936747       192.168.1.4           2.17.24.94            TCP      54     61855 → 443 [RST] Seq=25 Win=0 Len=0

Frame 20: 54 bytes on wire (432 bits), 54 bytes captured (432 bits) on interface en0, id 0
Ethernet II, Src: Apple_ec:49:ad (38:f9:d3:ec:49:ad), Dst: Sagemcom_b0:4f:d9 (f4:6b:ef:b0:4f:d9)
Internet Protocol Version 4, Src: 192.168.1.4, Dst: 2.17.24.94
Transmission Control Protocol, Src Port: 61855, Dst Port: 443, Seq: 25, Len: 0

No.     Time           Source                Destination           Protocol Length Info
     21 1.936747       192.168.1.4           2.17.24.94            TCP      54     61855 → 443 [RST] Seq=26 Win=0 Len=0

Frame 21: 54 bytes on wire (432 bits), 54 bytes captured (432 bits) on interface en0, id 0
Ethernet II, Src: Apple_ec:49:ad (38:f9:d3:ec:49:ad), Dst: Sagemcom_b0:4f:d9 (f4:6b:ef:b0:4f:d9)
Internet Protocol Version 4, Src: 192.168.1.4, Dst: 2.17.24.94
Transmission Control Protocol, Src Port: 61855, Dst Port: 443, Seq: 26, Len: 0

No.     Time           Source                Destination           Protocol Length Info
     22 3.820566       192.168.1.4           192.168.1.1           DNS      78     Standard query 0xa0f3 A mesu.g.aaplimg.com

Frame 22: 78 bytes on wire (624 bits), 78 bytes captured (624 bits) on interface en0, id 0
Ethernet II, Src: Apple_ec:49:ad (38:f9:d3:ec:49:ad), Dst: Sagemcom_b0:4f:d9 (f4:6b:ef:b0:4f:d9)
Internet Protocol Version 4, Src: 192.168.1.4, Dst: 192.168.1.1
User Datagram Protocol, Src Port: 56638, Dst Port: 53
Domain Name System (query)

No.     Time           Source                Destination           Protocol Length Info
     23 3.822107       192.168.1.4           104.89.8.63           TCP      78     61901 → 443 [SYN, ECN, CWR] Seq=0 Win=65535 Len=0 MSS=1460 WS=64 TSval=290692597 TSecr=0 SACK_PERM=1

Frame 23: 78 bytes on wire (624 bits), 78 bytes captured (624 bits) on interface en0, id 0
Ethernet II, Src: Apple_ec:49:ad (38:f9:d3:ec:49:ad), Dst: Sagemcom_b0:4f:d9 (f4:6b:ef:b0:4f:d9)
Internet Protocol Version 4, Src: 192.168.1.4, Dst: 104.89.8.63
Transmission Control Protocol, Src Port: 61901, Dst Port: 443, Seq: 0, Len: 0

No.     Time           Source                Destination           Protocol Length Info
     24 3.868904       192.168.1.1           192.168.1.4           DNS      110    Standard query response 0xa0f3 A mesu.g.aaplimg.com A 17.253.123.202 A 17.253.123.201

Frame 24: 110 bytes on wire (880 bits), 110 bytes captured (880 bits) on interface en0, id 0
Ethernet II, Src: Sagemcom_b0:4f:d9 (f4:6b:ef:b0:4f:d9), Dst: Apple_ec:49:ad (38:f9:d3:ec:49:ad)
Internet Protocol Version 4, Src: 192.168.1.1, Dst: 192.168.1.4
User Datagram Protocol, Src Port: 53, Dst Port: 56638
Domain Name System (response)

No.     Time           Source                Destination           Protocol Length Info
     25 3.925342       104.89.8.63           192.168.1.4           TCP      74     443 → 61901 [SYN, ACK, ECN] Seq=0 Ack=1 Win=65160 Len=0 MSS=1452 SACK_PERM=1 TSval=2467203215 TSecr=290692597 WS=128

Frame 25: 74 bytes on wire (592 bits), 74 bytes captured (592 bits) on interface en0, id 0
Ethernet II, Src: Sagemcom_b0:4f:d9 (f4:6b:ef:b0:4f:d9), Dst: Apple_ec:49:ad (38:f9:d3:ec:49:ad)
Internet Protocol Version 4, Src: 104.89.8.63, Dst: 192.168.1.4
Transmission Control Protocol, Src Port: 443, Dst Port: 61901, Seq: 0, Ack: 1, Len: 0

No.     Time           Source                Destination           Protocol Length Info
     26 3.925449       192.168.1.4           104.89.8.63           TCP      66     61901 → 443 [ACK] Seq=1 Ack=1 Win=132480 Len=0 TSval=290692700 TSecr=2467203215

Frame 26: 66 bytes on wire (528 bits), 66 bytes captured (528 bits) on interface en0, id 0
Ethernet II, Src: Apple_ec:49:ad (38:f9:d3:ec:49:ad), Dst: Sagemcom_b0:4f:d9 (f4:6b:ef:b0:4f:d9)
Internet Protocol Version 4, Src: 192.168.1.4, Dst: 104.89.8.63
Transmission Control Protocol, Src Port: 61901, Dst Port: 443, Seq: 1, Ack: 1, Len: 0

No.     Time           Source                Destination           Protocol Length Info
     27 3.926444       192.168.1.4           104.89.8.63           TLSv1.3  583    Client Hello

Frame 27: 583 bytes on wire (4664 bits), 583 bytes captured (4664 bits) on interface en0, id 0
Ethernet II, Src: Apple_ec:49:ad (38:f9:d3:ec:49:ad), Dst: Sagemcom_b0:4f:d9 (f4:6b:ef:b0:4f:d9)
Internet Protocol Version 4, Src: 192.168.1.4, Dst: 104.89.8.63
Transmission Control Protocol, Src Port: 61901, Dst Port: 443, Seq: 1, Ack: 1, Len: 517
Transport Layer Security

No.     Time           Source                Destination           Protocol Length Info
     28 4.013498       104.89.8.63           192.168.1.4           TCP      66     443 → 61901 [ACK] Seq=1 Ack=518 Win=64768 Len=0 TSval=2467203301 TSecr=290692701

Frame 28: 66 bytes on wire (528 bits), 66 bytes captured (528 bits) on interface en0, id 0
Ethernet II, Src: Sagemcom_b0:4f:d9 (f4:6b:ef:b0:4f:d9), Dst: Apple_ec:49:ad (38:f9:d3:ec:49:ad)
Internet Protocol Version 4, Src: 104.89.8.63, Dst: 192.168.1.4
Transmission Control Protocol, Src Port: 443, Dst Port: 61901, Seq: 1, Ack: 518, Len: 0

No.     Time           Source                Destination           Protocol Length Info
     29 4.014983       104.89.8.63           192.168.1.4           TLSv1.3  1506   Server Hello, Change Cipher Spec, Application Data

Frame 29: 1506 bytes on wire (12048 bits), 1506 bytes captured (12048 bits) on interface en0, id 0
Ethernet II, Src: Sagemcom_b0:4f:d9 (f4:6b:ef:b0:4f:d9), Dst: Apple_ec:49:ad (38:f9:d3:ec:49:ad)
Internet Protocol Version 4, Src: 104.89.8.63, Dst: 192.168.1.4
Transmission Control Protocol, Src Port: 443, Dst Port: 61901, Seq: 1, Ack: 518, Len: 1440
Transport Layer Security

No.     Time           Source                Destination           Protocol Length Info
     30 4.015742       104.89.8.63           192.168.1.4           TCP      1506   443 → 61901 [PSH, ACK] Seq=1441 Ack=518 Win=64768 Len=1440 TSval=2467203302 TSecr=290692701 [TCP segment of a reassembled PDU]

Frame 30: 1506 bytes on wire (12048 bits), 1506 bytes captured (12048 bits) on interface en0, id 0
Ethernet II, Src: Sagemcom_b0:4f:d9 (f4:6b:ef:b0:4f:d9), Dst: Apple_ec:49:ad (38:f9:d3:ec:49:ad)
Internet Protocol Version 4, Src: 104.89.8.63, Dst: 192.168.1.4
Transmission Control Protocol, Src Port: 443, Dst Port: 61901, Seq: 1441, Ack: 518, Len: 1440

No.     Time           Source                Destination           Protocol Length Info
     31 4.015786       192.168.1.4           104.89.8.63           TCP      66     61901 → 443 [ACK] Seq=518 Ack=2881 Win=129600 Len=0 TSval=290692788 TSecr=2467203302

Frame 31: 66 bytes on wire (528 bits), 66 bytes captured (528 bits) on interface en0, id 0
Ethernet II, Src: Apple_ec:49:ad (38:f9:d3:ec:49:ad), Dst: Sagemcom_b0:4f:d9 (f4:6b:ef:b0:4f:d9)
Internet Protocol Version 4, Src: 192.168.1.4, Dst: 104.89.8.63
Transmission Control Protocol, Src Port: 61901, Dst Port: 443, Seq: 518, Ack: 2881, Len: 0

No.     Time           Source                Destination           Protocol Length Info
     32 4.016703       104.89.8.63           192.168.1.4           TCP      1282   443 → 61901 [PSH, ACK] Seq=2881 Ack=518 Win=64768 Len=1216 TSval=2467203302 TSecr=290692701 [TCP segment of a reassembled PDU]

Frame 32: 1282 bytes on wire (10256 bits), 1282 bytes captured (10256 bits) on interface en0, id 0
Ethernet II, Src: Sagemcom_b0:4f:d9 (f4:6b:ef:b0:4f:d9), Dst: Apple_ec:49:ad (38:f9:d3:ec:49:ad)
Internet Protocol Version 4, Src: 104.89.8.63, Dst: 192.168.1.4
Transmission Control Protocol, Src Port: 443, Dst Port: 61901, Seq: 2881, Ack: 518, Len: 1216

No.     Time           Source                Destination           Protocol Length Info
     33 4.016731       192.168.1.4           104.89.8.63           TCP      66     61901 → 443 [ACK] Seq=518 Ack=4097 Win=129856 Len=0 TSval=290692789 TSecr=2467203302

Frame 33: 66 bytes on wire (528 bits), 66 bytes captured (528 bits) on interface en0, id 0
Ethernet II, Src: Apple_ec:49:ad (38:f9:d3:ec:49:ad), Dst: Sagemcom_b0:4f:d9 (f4:6b:ef:b0:4f:d9)
Internet Protocol Version 4, Src: 192.168.1.4, Dst: 104.89.8.63
Transmission Control Protocol, Src Port: 61901, Dst Port: 443, Seq: 518, Ack: 4097, Len: 0

No.     Time           Source                Destination           Protocol Length Info
     34 4.018199       104.89.8.63           192.168.1.4           TLSv1.3  1202   Application Data, Application Data, Application Data

Frame 34: 1202 bytes on wire (9616 bits), 1202 bytes captured (9616 bits) on interface en0, id 0
Ethernet II, Src: Sagemcom_b0:4f:d9 (f4:6b:ef:b0:4f:d9), Dst: Apple_ec:49:ad (38:f9:d3:ec:49:ad)
Internet Protocol Version 4, Src: 104.89.8.63, Dst: 192.168.1.4
Transmission Control Protocol, Src Port: 443, Dst Port: 61901, Seq: 4097, Ack: 518, Len: 1136
[4 Reassembled TCP Segments (4682 bytes): #29(1250), #30(1440), #32(1216), #34(776)]
Transport Layer Security
Transport Layer Security

No.     Time           Source                Destination           Protocol Length Info
     35 4.018226       192.168.1.4           104.89.8.63           TCP      66     61901 → 443 [ACK] Seq=518 Ack=5233 Win=129920 Len=0 TSval=290692790 TSecr=2467203302

Frame 35: 66 bytes on wire (528 bits), 66 bytes captured (528 bits) on interface en0, id 0
Ethernet II, Src: Apple_ec:49:ad (38:f9:d3:ec:49:ad), Dst: Sagemcom_b0:4f:d9 (f4:6b:ef:b0:4f:d9)
Internet Protocol Version 4, Src: 192.168.1.4, Dst: 104.89.8.63
Transmission Control Protocol, Src Port: 61901, Dst Port: 443, Seq: 518, Ack: 5233, Len: 0

No.     Time           Source                Destination           Protocol Length Info
     36 4.022725       192.168.1.4           104.89.8.63           TLSv1.3  146    Change Cipher Spec, Application Data

Frame 36: 146 bytes on wire (1168 bits), 146 bytes captured (1168 bits) on interface en0, id 0
Ethernet II, Src: Apple_ec:49:ad (38:f9:d3:ec:49:ad), Dst: Sagemcom_b0:4f:d9 (f4:6b:ef:b0:4f:d9)
Internet Protocol Version 4, Src: 192.168.1.4, Dst: 104.89.8.63
Transmission Control Protocol, Src Port: 61901, Dst Port: 443, Seq: 518, Ack: 5233, Len: 80
Transport Layer Security

No.     Time           Source                Destination           Protocol Length Info
     37 4.024015       192.168.1.4           104.89.8.63           TLSv1.3  477    Application Data

Frame 37: 477 bytes on wire (3816 bits), 477 bytes captured (3816 bits) on interface en0, id 0
Ethernet II, Src: Apple_ec:49:ad (38:f9:d3:ec:49:ad), Dst: Sagemcom_b0:4f:d9 (f4:6b:ef:b0:4f:d9)
Internet Protocol Version 4, Src: 192.168.1.4, Dst: 104.89.8.63
Transmission Control Protocol, Src Port: 61901, Dst Port: 443, Seq: 598, Ack: 5233, Len: 411
Transport Layer Security

No.     Time           Source                Destination           Protocol Length Info
     38 4.102244       104.89.8.63           192.168.1.4           TCP      66     443 → 61901 [ACK] Seq=5233 Ack=598 Win=64768 Len=0 TSval=2467203392 TSecr=290692794

Frame 38: 66 bytes on wire (528 bits), 66 bytes captured (528 bits) on interface en0, id 0
Ethernet II, Src: Sagemcom_b0:4f:d9 (f4:6b:ef:b0:4f:d9), Dst: Apple_ec:49:ad (38:f9:d3:ec:49:ad)
Internet Protocol Version 4, Src: 104.89.8.63, Dst: 192.168.1.4
Transmission Control Protocol, Src Port: 443, Dst Port: 61901, Seq: 5233, Ack: 598, Len: 0

No.     Time           Source                Destination           Protocol Length Info
     39 4.102780       104.89.8.63           192.168.1.4           TLSv1.3  353    Application Data

Frame 39: 353 bytes on wire (2824 bits), 353 bytes captured (2824 bits) on interface en0, id 0
Ethernet II, Src: Sagemcom_b0:4f:d9 (f4:6b:ef:b0:4f:d9), Dst: Apple_ec:49:ad (38:f9:d3:ec:49:ad)
Internet Protocol Version 4, Src: 104.89.8.63, Dst: 192.168.1.4
Transmission Control Protocol, Src Port: 443, Dst Port: 61901, Seq: 5233, Ack: 598, Len: 287
Transport Layer Security

No.     Time           Source                Destination           Protocol Length Info
     40 4.102784       104.89.8.63           192.168.1.4           TLSv1.3  353    Application Data

Frame 40: 353 bytes on wire (2824 bits), 353 bytes captured (2824 bits) on interface en0, id 0
Ethernet II, Src: Sagemcom_b0:4f:d9 (f4:6b:ef:b0:4f:d9), Dst: Apple_ec:49:ad (38:f9:d3:ec:49:ad)
Internet Protocol Version 4, Src: 104.89.8.63, Dst: 192.168.1.4
Transmission Control Protocol, Src Port: 443, Dst Port: 61901, Seq: 5520, Ack: 598, Len: 287
Transport Layer Security

No.     Time           Source                Destination           Protocol Length Info
     41 4.102893       192.168.1.4           104.89.8.63           TCP      66     61901 → 443 [ACK] Seq=1009 Ack=5520 Win=130752 Len=0 TSval=290692873 TSecr=2467203393

Frame 41: 66 bytes on wire (528 bits), 66 bytes captured (528 bits) on interface en0, id 0
Ethernet II, Src: Apple_ec:49:ad (38:f9:d3:ec:49:ad), Dst: Sagemcom_b0:4f:d9 (f4:6b:ef:b0:4f:d9)
Internet Protocol Version 4, Src: 192.168.1.4, Dst: 104.89.8.63
Transmission Control Protocol, Src Port: 61901, Dst Port: 443, Seq: 1009, Ack: 5520, Len: 0

No.     Time           Source                Destination           Protocol Length Info
     42 4.102894       192.168.1.4           104.89.8.63           TCP      66     61901 → 443 [ACK] Seq=1009 Ack=5807 Win=130496 Len=0 TSval=290692873 TSecr=2467203393

Frame 42: 66 bytes on wire (528 bits), 66 bytes captured (528 bits) on interface en0, id 0
Ethernet II, Src: Apple_ec:49:ad (38:f9:d3:ec:49:ad), Dst: Sagemcom_b0:4f:d9 (f4:6b:ef:b0:4f:d9)
Internet Protocol Version 4, Src: 192.168.1.4, Dst: 104.89.8.63
Transmission Control Protocol, Src Port: 61901, Dst Port: 443, Seq: 1009, Ack: 5807, Len: 0

No.     Time           Source                Destination           Protocol Length Info
     43 4.109520       104.89.8.63           192.168.1.4           TCP      66     443 → 61901 [ACK] Seq=5807 Ack=1009 Win=64384 Len=0 TSval=2467203400 TSecr=290692795

Frame 43: 66 bytes on wire (528 bits), 66 bytes captured (528 bits) on interface en0, id 0
Ethernet II, Src: Sagemcom_b0:4f:d9 (f4:6b:ef:b0:4f:d9), Dst: Apple_ec:49:ad (38:f9:d3:ec:49:ad)
Internet Protocol Version 4, Src: 104.89.8.63, Dst: 192.168.1.4
Transmission Control Protocol, Src Port: 443, Dst Port: 61901, Seq: 5807, Ack: 1009, Len: 0

No.     Time           Source                Destination           Protocol Length Info
     44 4.110170       104.89.8.63           192.168.1.4           TLSv1.3  364    Application Data

Frame 44: 364 bytes on wire (2912 bits), 364 bytes captured (2912 bits) on interface en0, id 0
Ethernet II, Src: Sagemcom_b0:4f:d9 (f4:6b:ef:b0:4f:d9), Dst: Apple_ec:49:ad (38:f9:d3:ec:49:ad)
Internet Protocol Version 4, Src: 104.89.8.63, Dst: 192.168.1.4
Transmission Control Protocol, Src Port: 443, Dst Port: 61901, Seq: 5807, Ack: 1009, Len: 298
Transport Layer Security

No.     Time           Source                Destination           Protocol Length Info
     45 4.110288       192.168.1.4           104.89.8.63           TCP      66     61901 → 443 [ACK] Seq=1009 Ack=6105 Win=130752 Len=0 TSval=290692880 TSecr=2467203401

Frame 45: 66 bytes on wire (528 bits), 66 bytes captured (528 bits) on interface en0, id 0
Ethernet II, Src: Apple_ec:49:ad (38:f9:d3:ec:49:ad), Dst: Sagemcom_b0:4f:d9 (f4:6b:ef:b0:4f:d9)
Internet Protocol Version 4, Src: 192.168.1.4, Dst: 104.89.8.63
Transmission Control Protocol, Src Port: 61901, Dst Port: 443, Seq: 1009, Ack: 6105, Len: 0

No.     Time           Source                Destination           Protocol Length Info
     46 5.856636       52.97.155.114         192.168.1.4           TLSv1.2  89     Application Data

Frame 46: 89 bytes on wire (712 bits), 89 bytes captured (712 bits) on interface en0, id 0
Ethernet II, Src: Sagemcom_b0:4f:d9 (f4:6b:ef:b0:4f:d9), Dst: Apple_ec:49:ad (38:f9:d3:ec:49:ad)
Internet Protocol Version 4, Src: 52.97.155.114, Dst: 192.168.1.4
Transmission Control Protocol, Src Port: 443, Dst Port: 61765, Seq: 1, Ack: 1, Len: 35
Transport Layer Security

No.     Time           Source                Destination           Protocol Length Info
     47 5.858033       52.97.155.114         192.168.1.4           TLSv1.2  1145   Application Data

Frame 47: 1145 bytes on wire (9160 bits), 1145 bytes captured (9160 bits) on interface en0, id 0
Ethernet II, Src: Sagemcom_b0:4f:d9 (f4:6b:ef:b0:4f:d9), Dst: Apple_ec:49:ad (38:f9:d3:ec:49:ad)
Internet Protocol Version 4, Src: 52.97.155.114, Dst: 192.168.1.4
Transmission Control Protocol, Src Port: 443, Dst Port: 61765, Seq: 36, Ack: 1, Len: 1091
Transport Layer Security

No.     Time           Source                Destination           Protocol Length Info
     48 5.858035       52.97.155.114         192.168.1.4           TLSv1.2  89     Application Data

Frame 48: 89 bytes on wire (712 bits), 89 bytes captured (712 bits) on interface en0, id 0
Ethernet II, Src: Sagemcom_b0:4f:d9 (f4:6b:ef:b0:4f:d9), Dst: Apple_ec:49:ad (38:f9:d3:ec:49:ad)
Internet Protocol Version 4, Src: 52.97.155.114, Dst: 192.168.1.4
Transmission Control Protocol, Src Port: 443, Dst Port: 61765, Seq: 1127, Ack: 1, Len: 35
Transport Layer Security

No.     Time           Source                Destination           Protocol Length Info
     49 5.858046       192.168.1.4           52.97.155.114         TCP      54     61765 → 443 [ACK] Seq=1 Ack=36 Win=4095 Len=0

Frame 49: 54 bytes on wire (432 bits), 54 bytes captured (432 bits) on interface en0, id 0
Ethernet II, Src: Apple_ec:49:ad (38:f9:d3:ec:49:ad), Dst: Sagemcom_b0:4f:d9 (f4:6b:ef:b0:4f:d9)
Internet Protocol Version 4, Src: 192.168.1.4, Dst: 52.97.155.114
Transmission Control Protocol, Src Port: 61765, Dst Port: 443, Seq: 1, Ack: 36, Len: 0

No.     Time           Source                Destination           Protocol Length Info
     50 5.858100       192.168.1.4           52.97.155.114         TCP      54     61765 → 443 [ACK] Seq=1 Ack=1127 Win=4078 Len=0

Frame 50: 54 bytes on wire (432 bits), 54 bytes captured (432 bits) on interface en0, id 0
Ethernet II, Src: Apple_ec:49:ad (38:f9:d3:ec:49:ad), Dst: Sagemcom_b0:4f:d9 (f4:6b:ef:b0:4f:d9)
Internet Protocol Version 4, Src: 192.168.1.4, Dst: 52.97.155.114
Transmission Control Protocol, Src Port: 61765, Dst Port: 443, Seq: 1, Ack: 1127, Len: 0

No.     Time           Source                Destination           Protocol Length Info
     51 5.858125       192.168.1.4           52.97.155.114         TCP      54     61765 → 443 [ACK] Seq=1 Ack=1162 Win=4078 Len=0

Frame 51: 54 bytes on wire (432 bits), 54 bytes captured (432 bits) on interface en0, id 0
Ethernet II, Src: Apple_ec:49:ad (38:f9:d3:ec:49:ad), Dst: Sagemcom_b0:4f:d9 (f4:6b:ef:b0:4f:d9)
Internet Protocol Version 4, Src: 192.168.1.4, Dst: 52.97.155.114
Transmission Control Protocol, Src Port: 61765, Dst Port: 443, Seq: 1, Ack: 1162, Len: 0

No.     Time           Source                Destination           Protocol Length Info
     52 6.024549       192.168.1.4           104.89.8.63           TLSv1.3  90     Application Data

Frame 52: 90 bytes on wire (720 bits), 90 bytes captured (720 bits) on interface en0, id 0
Ethernet II, Src: Apple_ec:49:ad (38:f9:d3:ec:49:ad), Dst: Sagemcom_b0:4f:d9 (f4:6b:ef:b0:4f:d9)
Internet Protocol Version 4, Src: 192.168.1.4, Dst: 104.89.8.63
Transmission Control Protocol, Src Port: 61901, Dst Port: 443, Seq: 1009, Ack: 6105, Len: 24
Transport Layer Security

No.     Time           Source                Destination           Protocol Length Info
     53 6.024997       192.168.1.4           104.89.8.63           TCP      66     61901 → 443 [FIN, ACK] Seq=1033 Ack=6105 Win=131072 Len=0 TSval=290694788 TSecr=2467203401

Frame 53: 66 bytes on wire (528 bits), 66 bytes captured (528 bits) on interface en0, id 0
Ethernet II, Src: Apple_ec:49:ad (38:f9:d3:ec:49:ad), Dst: Sagemcom_b0:4f:d9 (f4:6b:ef:b0:4f:d9)
Internet Protocol Version 4, Src: 192.168.1.4, Dst: 104.89.8.63
Transmission Control Protocol, Src Port: 61901, Dst Port: 443, Seq: 1033, Ack: 6105, Len: 0

No.     Time           Source                Destination           Protocol Length Info
     54 6.103482       104.89.8.63           192.168.1.4           TCP      66     443 → 61901 [ACK] Seq=6105 Ack=1033 Win=64384 Len=0 TSval=2467205394 TSecr=290694787

Frame 54: 66 bytes on wire (528 bits), 66 bytes captured (528 bits) on interface en0, id 0
Ethernet II, Src: Sagemcom_b0:4f:d9 (f4:6b:ef:b0:4f:d9), Dst: Apple_ec:49:ad (38:f9:d3:ec:49:ad)
Internet Protocol Version 4, Src: 104.89.8.63, Dst: 192.168.1.4
Transmission Control Protocol, Src Port: 443, Dst Port: 61901, Seq: 6105, Ack: 1033, Len: 0

No.     Time           Source                Destination           Protocol Length Info
     55 6.104204       104.89.8.63           192.168.1.4           TLSv1.3  90     Application Data

Frame 55: 90 bytes on wire (720 bits), 90 bytes captured (720 bits) on interface en0, id 0
Ethernet II, Src: Sagemcom_b0:4f:d9 (f4:6b:ef:b0:4f:d9), Dst: Apple_ec:49:ad (38:f9:d3:ec:49:ad)
Internet Protocol Version 4, Src: 104.89.8.63, Dst: 192.168.1.4
Transmission Control Protocol, Src Port: 443, Dst Port: 61901, Seq: 6105, Ack: 1033, Len: 24
Transport Layer Security

No.     Time           Source                Destination           Protocol Length Info
     56 6.104208       104.89.8.63           192.168.1.4           TCP      66     443 → 61901 [FIN, ACK] Seq=6129 Ack=1033 Win=64384 Len=0 TSval=2467205394 TSecr=290694787

Frame 56: 66 bytes on wire (528 bits), 66 bytes captured (528 bits) on interface en0, id 0
Ethernet II, Src: Sagemcom_b0:4f:d9 (f4:6b:ef:b0:4f:d9), Dst: Apple_ec:49:ad (38:f9:d3:ec:49:ad)
Internet Protocol Version 4, Src: 104.89.8.63, Dst: 192.168.1.4
Transmission Control Protocol, Src Port: 443, Dst Port: 61901, Seq: 6129, Ack: 1033, Len: 0

No.     Time           Source                Destination           Protocol Length Info
     57 6.104299       192.168.1.4           104.89.8.63           TCP      54     61901 → 443 [RST] Seq=1033 Win=0 Len=0

Frame 57: 54 bytes on wire (432 bits), 54 bytes captured (432 bits) on interface en0, id 0
Ethernet II, Src: Apple_ec:49:ad (38:f9:d3:ec:49:ad), Dst: Sagemcom_b0:4f:d9 (f4:6b:ef:b0:4f:d9)
Internet Protocol Version 4, Src: 192.168.1.4, Dst: 104.89.8.63
Transmission Control Protocol, Src Port: 61901, Dst Port: 443, Seq: 1033, Len: 0

No.     Time           Source                Destination           Protocol Length Info
     58 6.104299       192.168.1.4           104.89.8.63           TCP      54     61901 → 443 [RST] Seq=1033 Win=0 Len=0

Frame 58: 54 bytes on wire (432 bits), 54 bytes captured (432 bits) on interface en0, id 0
Ethernet II, Src: Apple_ec:49:ad (38:f9:d3:ec:49:ad), Dst: Sagemcom_b0:4f:d9 (f4:6b:ef:b0:4f:d9)
Internet Protocol Version 4, Src: 192.168.1.4, Dst: 104.89.8.63
Transmission Control Protocol, Src Port: 61901, Dst Port: 443, Seq: 1033, Len: 0

No.     Time           Source                Destination           Protocol Length Info
     59 6.104629       104.89.8.63           192.168.1.4           TCP      66     443 → 61901 [ACK] Seq=6130 Ack=1034 Win=64384 Len=0 TSval=2467205395 TSecr=290694788

Frame 59: 66 bytes on wire (528 bits), 66 bytes captured (528 bits) on interface en0, id 0
Ethernet II, Src: Sagemcom_b0:4f:d9 (f4:6b:ef:b0:4f:d9), Dst: Apple_ec:49:ad (38:f9:d3:ec:49:ad)
Internet Protocol Version 4, Src: 104.89.8.63, Dst: 192.168.1.4
Transmission Control Protocol, Src Port: 443, Dst Port: 61901, Seq: 6130, Ack: 1034, Len: 0

No.     Time           Source                Destination           Protocol Length Info
     60 6.104680       192.168.1.4           104.89.8.63           TCP      54     61901 → 443 [RST] Seq=1034 Win=0 Len=0

Frame 60: 54 bytes on wire (432 bits), 54 bytes captured (432 bits) on interface en0, id 0
Ethernet II, Src: Apple_ec:49:ad (38:f9:d3:ec:49:ad), Dst: Sagemcom_b0:4f:d9 (f4:6b:ef:b0:4f:d9)
Internet Protocol Version 4, Src: 192.168.1.4, Dst: 104.89.8.63
Transmission Control Protocol, Src Port: 61901, Dst Port: 443, Seq: 1034, Len: 0
